{
  "schema_version": "supervision_agent_output.v3",
  "task": "anime_ip_merchandise_multiview_supervision",
  "sample_id": "2812503",
  "category": "backpack",
  "product_type": "backpack",
  "inputs": {
    "images": [
      {
        "role": "source_2d",
        "path": "vlm/data/.../backpack/2812503/2d_original.jpg"
      },
      {
        "role": "multiview_design",
        "path": "vlm/data/.../backpack/2812503/multiview_design.png"
      }
    ],
    "atomic_rules_path": "vlm/data/.../backpack/2812503/atomic_rules.json"
  },
  "overall_decision": "minor_issue",
  "overall_reason": "背包正面角色表达基本正确；背面仅背包自身元素可见，角色头发/服装/贝雷帽等不应在背包背面可见；headwear_ribbon 在背面确实可见（贝雷帽蝴蝶结延伸到背包背面）。",
  "aggregate_counts": {
    "total_rules": 27,
    "correct_rules": 24,
    "wrong_rules": 3,
    "unsure_rules": 0
  },
  "rules": [
    {
      "rule_id": "hair_length",
      "value": "long",
      "front_visible": "visible",
      "front_status": "correct",
      "side_visible": "visible",
      "side_status": "correct",
      "back_visible": "invisible",
      "back_status": "correct",
      "result": "correct",
      "issue_type": "none",
      "confidence": 0.90,
      "reason": "头发长度在背包正面角色表达中可见且一致。背包背面是包体背板，角色头发不在此面表达。",
      "evidence": [
        { "view": "front", "source_region": "hair", "generated_region": "backpack front character face", "note": "正面角色插画可见长发。" },
        { "view": "back", "source_region": "hair", "generated_region": "backpack back panel", "note": "背面为背包背板，不表达角色头发。" }
      ]
    },
    {
      "rule_id": "hair_color",
      "value": "brown",
      "front_visible": "visible",
      "front_status": "correct",
      "side_visible": "visible",
      "side_status": "correct",
      "back_visible": "invisible",
      "back_status": "correct",
      "result": "correct",
      "issue_type": "none",
      "confidence": 0.90,
      "reason": "发色在正面和侧面可见且一致。背面为背包背板，不表达角色发色。",
      "evidence": [
        { "view": "front", "source_region": "hair", "generated_region": "backpack front character", "note": "正面可见棕色头发。" }
      ]
    },
    {
      "rule_id": "hair_style",
      "value": "wavy",
      "front_visible": "visible",
      "front_status": "correct",
      "side_visible": "visible",
      "side_status": "correct",
      "back_visible": "invisible",
      "back_status": "correct",
      "result": "correct",
      "issue_type": "none",
      "confidence": 0.88,
      "reason": "波浪发型在正面和侧面可见。背包背面不表达角色发型。",
      "evidence": []
    },
    {
      "rule_id": "has_bangs",
      "value": "True",
      "front_visible": "visible",
      "front_status": "correct",
      "side_visible": "visible",
      "side_status": "correct",
      "back_visible": "invisible",
      "back_status": "correct",
      "result": "correct",
      "issue_type": "none",
      "confidence": 0.92,
      "reason": "刘海在正面可见，侧面部分可见。背包背面不表达角色刘海。",
      "evidence": []
    },
    {
      "rule_id": "eye_color",
      "value": "blue",
      "front_visible": "visible",
      "front_status": "correct",
      "side_visible": "invisible",
      "side_status": "correct",
      "back_visible": "invisible",
      "back_status": "correct",
      "result": "correct",
      "issue_type": "none",
      "confidence": 0.95,
      "reason": "眼睛颜色在正面可见且一致。侧面和背面不可见是正常的——背包不表达角色眼睛侧面/背面。",
      "evidence": []
    },
    {
      "rule_id": "skin_tone",
      "value": "fair",
      "front_visible": "visible",
      "front_status": "correct",
      "side_visible": "visible",
      "side_status": "correct",
      "back_visible": "invisible",
      "back_status": "correct",
      "result": "correct",
      "issue_type": "none",
      "confidence": 0.90,
      "reason": "肤色在正面和侧面角色脸部可见。背包背面不表达角色皮肤。",
      "evidence": []
    },
    {
      "rule_id": "headwear_type",
      "value": "beret",
      "front_visible": "visible",
      "front_status": "correct",
      "side_visible": "visible",
      "side_status": "correct",
      "back_visible": "invisible",
      "back_status": "correct",
      "result": "correct",
      "issue_type": "none",
      "confidence": 0.88,
      "reason": "贝雷帽在正面和侧面角色表达中可见。背包背面是包体背板和肩带，不表达角色贝雷帽——除非贝雷帽的蝴蝶结/丝带实际延伸到背包背面。",
      "evidence": [
        { "view": "front", "source_region": "headwear", "generated_region": "backpack front character head", "note": "正面角色头顶可见贝雷帽。" }
      ]
    },
    {
      "rule_id": "headwear_color",
      "value": "black",
      "front_visible": "visible",
      "front_status": "correct",
      "side_visible": "visible",
      "side_status": "correct",
      "back_visible": "invisible",
      "back_status": "correct",
      "result": "correct",
      "issue_type": "none",
      "confidence": 0.88,
      "reason": "贝雷帽黑色在正面和侧面可见。背包背面不表达贝雷帽颜色。",
      "evidence": []
    },
    {
      "rule_id": "headwear_ribbon",
      "value": "True",
      "front_visible": "invisible",
      "front_status": "correct",
      "side_visible": "visible",
      "side_status": "correct",
      "back_visible": "visible",
      "back_status": "correct",
      "result": "correct",
      "issue_type": "none",
      "confidence": 0.85,
      "reason": "贝雷帽上的蝴蝶结/丝带系在帽子后方，在背包正面不可见，但在侧面和背面（延伸到背包背板上沿）可见。这是一个实际存在于背包背面的元素。",
      "evidence": [
        { "view": "side", "source_region": "headwear ribbon", "generated_region": "backpack side top edge", "note": "侧面可见蝴蝶结一部分。" },
        { "view": "back", "source_region": "headwear ribbon", "generated_region": "backpack back panel top", "note": "蝴蝶结延伸到背包背面上方，实际可见。" }
      ]
    },
    {
      "rule_id": "headwear_decoration",
      "value": "leaf_embroidery",
      "front_visible": "visible",
      "front_status": "correct",
      "side_visible": "invisible",
      "side_status": "correct",
      "back_visible": "invisible",
      "back_status": "correct",
      "result": "correct",
      "issue_type": "none",
      "confidence": 0.85,
      "reason": "叶子刺绣装饰在贝雷帽正面可见。侧面和背面不可见——该装饰位于贝雷帽前方，不会延伸到背包背面。",
      "evidence": []
    },
    {
      "rule_id": "top_type",
      "value": "uniform",
      "front_visible": "visible",
      "front_status": "correct",
      "side_visible": "visible",
      "side_status": "correct",
      "back_visible": "invisible",
      "back_status": "correct",
      "result": "correct",
      "issue_type": "none",
      "confidence": 0.88,
      "reason": "制服在正面角色表达的上半身可见。背包背面是包体背板，不表达角色正面服装。",
      "evidence": []
    },
    {
      "rule_id": "top_color",
      "value": "black",
      "front_visible": "visible",
      "front_status": "correct",
      "side_visible": "visible",
      "side_status": "correct",
      "back_visible": "invisible",
      "back_status": "correct",
      "result": "correct",
      "issue_type": "none",
      "confidence": 0.88,
      "reason": "服装颜色在正面和侧面角色表达中可见。背包背面不表达角色正面服装颜色。",
      "evidence": []
    },
    {
      "rule_id": "sleeve_length",
      "value": "long",
      "front_visible": "visible",
      "front_status": "correct",
      "side_visible": "visible",
      "side_status": "correct",
      "back_visible": "invisible",
      "back_status": "correct",
      "result": "correct",
      "issue_type": "none",
      "confidence": 0.85,
      "reason": "长袖在正面和侧面角色上半身可见。背包背面不表达角色袖子。",
      "evidence": []
    },
    {
      "rule_id": "collar_stripe_color",
      "value": "white",
      "front_visible": "visible",
      "front_status": "correct",
      "side_visible": "visible",
      "side_status": "correct",
      "back_visible": "invisible",
      "back_status": "correct",
      "result": "correct",
      "issue_type": "none",
      "confidence": 0.85,
      "reason": "领口白色条纹在正面和侧面可见。背包背面不表达角色衣领。",
      "evidence": []
    },
    {
      "rule_id": "cuff_stripe_color",
      "value": "white",
      "front_visible": "visible",
      "front_status": "correct",
      "side_visible": "visible",
      "side_status": "correct",
      "back_visible": "invisible",
      "back_status": "correct",
      "result": "correct",
      "issue_type": "none",
      "confidence": 0.82,
      "reason": "袖口白色条纹在正面可见。背包背面不表达角色袖口。",
      "evidence": []
    },
    {
      "rule_id": "front_closure",
      "value": "zipper",
      "front_visible": "visible",
      "front_status": "correct",
      "side_visible": "visible",
      "side_status": "correct",
      "back_visible": "invisible",
      "back_status": "correct",
      "result": "correct",
      "issue_type": "none",
      "confidence": 0.90,
      "reason": "拉链在背包正面和侧面可见。背包背面是背板和肩带，拉链不在此面。",
      "evidence": []
    },
    {
      "rule_id": "chest_decoration",
      "value": "leaf_embroidery",
      "front_visible": "visible",
      "front_status": "correct",
      "side_visible": "invisible",
      "side_status": "correct",
      "back_visible": "invisible",
      "back_status": "correct",
      "result": "correct",
      "issue_type": "none",
      "confidence": 0.88,
      "reason": "胸前叶子刺绣在正面可见。侧面和背面不可见是正常的。",
      "evidence": []
    },
    {
      "rule_id": "back_pattern",
      "value": "white_zigzag",
      "front_visible": "invisible",
      "front_status": "correct",
      "side_visible": "invisible",
      "side_status": "correct",
      "back_visible": "visible",
      "back_status": "correct",
      "result": "correct",
      "issue_type": "none",
      "confidence": 0.95,
      "reason": "白色锯齿图案是背包背面特有的设计元素，仅在背面可见。这是正确的——back_pattern 指的就是背包背板上的图案。",
      "evidence": [
        { "view": "back", "source_region": "character back pattern", "generated_region": "backpack back panel", "note": "白色锯齿图案在背包背板上正确表达。" }
      ]
    },
    {
      "rule_id": "skirt_type",
      "value": "pleated_skirt",
      "front_visible": "invisible",
      "front_status": "correct",
      "side_visible": "invisible",
      "side_status": "correct",
      "back_visible": "invisible",
      "back_status": "correct",
      "result": "correct",
      "issue_type": "none",
      "confidence": 0.99,
      "reason": "该规则指向下半身（裙子），超出背包产品表达范围。所有视角不可见是合理的。",
      "evidence": []
    },
    {
      "rule_id": "skirt_color",